
*** Running vivado
    with args -log matrixmul.vdi -applog -m64 -messageDb vivado.pb -mode batch -source matrixmul.tcl -notrace


****** Vivado v2014.4 (64-bit)
  **** SW Build 1071353 on Tue Nov 18 18:29:27 MST 2014
  **** IP Build 1070531 on Tue Nov 18 01:10:18 MST 2014
    ** Copyright 1986-2014 Xilinx, Inc. All Rights Reserved.

source matrixmul.tcl -notrace
Command: open_checkpoint C:/Users/Kasper/Documents/GitHub/TIHSC/Exercise2/HLS_labs/lab1/matrixmul.prj/solution1/impl/vhdl/project.runs/impl_1/matrixmul.dcp
INFO: [Netlist 29-17] Analyzing 17 Unisim elements for replacement
INFO: [Netlist 29-28] Unisim Transformation completed in 0 CPU seconds
INFO: [Project 1-479] Netlist was created with Vivado 2014.4
Loading clock regions from c:/Xilinx/Vivado/2014.4/data\parts/xilinx/zynq/zynq/xc7z010/ClockRegion.xml
Loading clock buffers from c:/Xilinx/Vivado/2014.4/data\parts/xilinx/zynq/zynq/xc7z010/ClockBuffers.xml
Loading clock placement rules from c:/Xilinx/Vivado/2014.4/data/parts/xilinx/zynq/ClockPlacerRules.xml
Loading package pin functions from c:/Xilinx/Vivado/2014.4/data\parts/xilinx/zynq/PinFunctions.xml...
Loading package from c:/Xilinx/Vivado/2014.4/data\parts/xilinx/zynq/zynq/xc7z010/clg400/Package.xml
Loading io standards from c:/Xilinx/Vivado/2014.4/data\./parts/xilinx/zynq/IOStandards.xml
INFO: [Project 1-570] Preparing netlist for logic optimization
Parsing XDC File [C:/Users/Kasper/Documents/GitHub/TIHSC/Exercise2/HLS_labs/lab1/matrixmul.prj/solution1/impl/vhdl/project.runs/impl_1/.Xil/Vivado-14616-KASPER-PC/dcp/matrixmul.xdc]
Finished Parsing XDC File [C:/Users/Kasper/Documents/GitHub/TIHSC/Exercise2/HLS_labs/lab1/matrixmul.prj/solution1/impl/vhdl/project.runs/impl_1/.Xil/Vivado-14616-KASPER-PC/dcp/matrixmul.xdc]
INFO: [Opt 31-138] Pushed 0 inverter(s) to 0 load pin(s).
INFO: [Project 1-111] Unisim Transformation Summary:
No Unisim elements were transformed.

INFO: [Project 1-484] Checkpoint was created with build 1071353
open_checkpoint: Time (s): cpu = 00:00:09 ; elapsed = 00:00:09 . Memory (MB): peak = 440.738 ; gain = 269.809
Command: opt_design
Attempting to get a license for feature 'Implementation' and/or device 'xc7z010'
INFO: [Common 17-349] Got license for feature 'Implementation' and/or device 'xc7z010'
Running DRC as a precondition to command opt_design

Starting DRC Task
INFO: [Drc 23-27] Running DRC with 2 threads
INFO: [Project 1-461] DRC finished with 0 Errors
INFO: [Project 1-462] Please refer to the DRC report (report_drc) for more information.

Time (s): cpu = 00:00:00 ; elapsed = 00:00:00.150 . Memory (MB): peak = 443.781 ; gain = 3.043
INFO: [Timing 38-35] Done setting XDC timing constraints.

Starting Logic Optimization Task

Phase 1 Retarget

INFO: [Opt 31-138] Pushed 0 inverter(s) to 0 load pin(s).
INFO: [Opt 31-49] Retargeted 0 cell(s).
Phase 1 Retarget | Checksum: 1394c6222

Time (s): cpu = 00:00:00 ; elapsed = 00:00:00.020 . Memory (MB): peak = 915.375 ; gain = 0.000

Phase 2 Constant Propagation
INFO: [Opt 31-138] Pushed 0 inverter(s) to 0 load pin(s).
INFO: [Opt 31-10] Eliminated 1 cells.
Phase 2 Constant Propagation | Checksum: 1029801cb

Time (s): cpu = 00:00:00 ; elapsed = 00:00:00.050 . Memory (MB): peak = 915.375 ; gain = 0.000

Phase 3 Sweep
INFO: [Opt 31-12] Eliminated 43 unconnected nets.
INFO: [Opt 31-11] Eliminated 0 unconnected cells.
Phase 3 Sweep | Checksum: 12e3cf8df

Time (s): cpu = 00:00:00 ; elapsed = 00:00:00.080 . Memory (MB): peak = 915.375 ; gain = 0.000
Ending Logic Optimization Task | Checksum: 12e3cf8df

Time (s): cpu = 00:00:00 ; elapsed = 00:00:00.080 . Memory (MB): peak = 915.375 ; gain = 0.000
Implement Debug Cores | Checksum: 1394c6222
Logic Optimization | Checksum: 1394c6222

Starting Power Optimization Task
INFO: [Pwropt 34-132] Skipping clock gating for clocks with a period < 3.13 ns.
Ending Power Optimization Task | Checksum: 12e3cf8df

Time (s): cpu = 00:00:00 ; elapsed = 00:00:00.020 . Memory (MB): peak = 915.375 ; gain = 0.000
INFO: [Common 17-83] Releasing license: Implementation
20 Infos, 0 Warnings, 0 Critical Warnings and 0 Errors encountered.
opt_design completed successfully
opt_design: Time (s): cpu = 00:00:20 ; elapsed = 00:00:22 . Memory (MB): peak = 915.375 ; gain = 474.637
INFO: [Timing 38-35] Done setting XDC timing constraints.
INFO: [Drc 23-27] Running DRC with 2 threads
INFO: [Coretcl 2-168] The results of DRC are in file C:/Users/Kasper/Documents/GitHub/TIHSC/Exercise2/HLS_labs/lab1/matrixmul.prj/solution1/impl/vhdl/project.runs/impl_1/matrixmul_drc_opted.rpt.
Command: place_design
Attempting to get a license for feature 'Implementation' and/or device 'xc7z010'
INFO: [Common 17-349] Got license for feature 'Implementation' and/or device 'xc7z010'
INFO: [Drc 23-27] Running DRC with 2 threads
INFO: [Vivado_Tcl 4-198] DRC finished with 0 Errors
INFO: [Vivado_Tcl 4-199] Please refer to the DRC report (report_drc) for more information.
Running DRC as a precondition to command place_design
INFO: [Drc 23-27] Running DRC with 2 threads
INFO: [Vivado_Tcl 4-198] DRC finished with 0 Errors
INFO: [Vivado_Tcl 4-199] Please refer to the DRC report (report_drc) for more information.

Starting Placer Task
INFO: [Place 30-611] Multithreading enabled for place_design using a maximum of 2 CPUs

Phase 1 Placer Runtime Estimator
Phase 1 Placer Runtime Estimator | Checksum: b4d2d452

Time (s): cpu = 00:00:00 ; elapsed = 00:00:00.030 . Memory (MB): peak = 932.539 ; gain = 0.000

Phase 2 Placer Initialization

Phase 2.1 Placer Initialization Core
Netlist sorting complete. Time (s): cpu = 00:00:00 ; elapsed = 00:00:00 . Memory (MB): peak = 932.539 ; gain = 0.000
Netlist sorting complete. Time (s): cpu = 00:00:00 ; elapsed = 00:00:00 . Memory (MB): peak = 932.539 ; gain = 0.000

Phase 2.1.1 IO Placement/ Clock Placement/ Build Placer Device

Phase 2.1.1.1 Pre-Place Cells
Phase 2.1.1.1 Pre-Place Cells | Checksum: 00000000

Time (s): cpu = 00:00:00 ; elapsed = 00:00:00.050 . Memory (MB): peak = 932.539 ; gain = 0.000

Phase 2.1.1.2 IO & Clk Clean Up
Phase 2.1.1.2 IO & Clk Clean Up | Checksum: 00000000

Time (s): cpu = 00:00:01 ; elapsed = 00:00:00.660 . Memory (MB): peak = 932.539 ; gain = 0.000

Phase 2.1.1.3 Implementation Feasibility check On IDelay
Phase 2.1.1.3 Implementation Feasibility check On IDelay | Checksum: 00000000

Time (s): cpu = 00:00:01 ; elapsed = 00:00:00.660 . Memory (MB): peak = 932.539 ; gain = 0.000

Phase 2.1.1.4 Commit IO Placement
Phase 2.1.1.4 Commit IO Placement | Checksum: 00000000

Time (s): cpu = 00:00:01 ; elapsed = 00:00:00.660 . Memory (MB): peak = 932.539 ; gain = 0.000
Phase 2.1.1 IO Placement/ Clock Placement/ Build Placer Device | Checksum: b3b96b3a

Time (s): cpu = 00:00:01 ; elapsed = 00:00:00.660 . Memory (MB): peak = 932.539 ; gain = 0.000

Phase 2.1.2 Build Placer Netlist Model

Phase 2.1.2.1 Place Init Design

Phase 2.1.2.1.1 Init Lut Pin Assignment
Phase 2.1.2.1.1 Init Lut Pin Assignment | Checksum: 14f65a503

Time (s): cpu = 00:00:01 ; elapsed = 00:00:00.720 . Memory (MB): peak = 932.539 ; gain = 0.000
Phase 2.1.2.1 Place Init Design | Checksum: 1acd94314

Time (s): cpu = 00:00:01 ; elapsed = 00:00:00.850 . Memory (MB): peak = 932.539 ; gain = 0.000
Phase 2.1.2 Build Placer Netlist Model | Checksum: 1acd94314

Time (s): cpu = 00:00:01 ; elapsed = 00:00:00.850 . Memory (MB): peak = 932.539 ; gain = 0.000

Phase 2.1.3 Constrain Clocks/Macros

Phase 2.1.3.1 Constrain Global/Regional Clocks
Phase 2.1.3.1 Constrain Global/Regional Clocks | Checksum: 1acd94314

Time (s): cpu = 00:00:01 ; elapsed = 00:00:00.850 . Memory (MB): peak = 932.539 ; gain = 0.000
Phase 2.1.3 Constrain Clocks/Macros | Checksum: 1acd94314

Time (s): cpu = 00:00:01 ; elapsed = 00:00:00.850 . Memory (MB): peak = 932.539 ; gain = 0.000
Phase 2.1 Placer Initialization Core | Checksum: 1acd94314

Time (s): cpu = 00:00:01 ; elapsed = 00:00:00.850 . Memory (MB): peak = 932.539 ; gain = 0.000
Phase 2 Placer Initialization | Checksum: 1acd94314

Time (s): cpu = 00:00:01 ; elapsed = 00:00:00.850 . Memory (MB): peak = 932.539 ; gain = 0.000

Phase 3 Global Placement
Phase 3 Global Placement | Checksum: cb93d858

Time (s): cpu = 00:00:01 ; elapsed = 00:00:01 . Memory (MB): peak = 932.539 ; gain = 0.000

Phase 4 Detail Placement

Phase 4.1 Commit Multi Column Macros
Phase 4.1 Commit Multi Column Macros | Checksum: cb93d858

Time (s): cpu = 00:00:01 ; elapsed = 00:00:01 . Memory (MB): peak = 932.539 ; gain = 0.000

Phase 4.2 Commit Most Macros & LUTRAMs
Phase 4.2 Commit Most Macros & LUTRAMs | Checksum: 1a7017ece

Time (s): cpu = 00:00:01 ; elapsed = 00:00:01 . Memory (MB): peak = 932.539 ; gain = 0.000

Phase 4.3 Area Swap Optimization
Phase 4.3 Area Swap Optimization | Checksum: d856430b

Time (s): cpu = 00:00:01 ; elapsed = 00:00:01 . Memory (MB): peak = 932.539 ; gain = 0.000

Phase 4.4 updateClock Trees: DP
Phase 4.4 updateClock Trees: DP | Checksum: d856430b

Time (s): cpu = 00:00:01 ; elapsed = 00:00:01 . Memory (MB): peak = 932.539 ; gain = 0.000

Phase 4.5 Timing Path Optimizer
Phase 4.5 Timing Path Optimizer | Checksum: 1b782d77a

Time (s): cpu = 00:00:02 ; elapsed = 00:00:01 . Memory (MB): peak = 932.539 ; gain = 0.000

Phase 4.6 Small Shape Detail Placement

Phase 4.6.1 Commit Small Macros & Core Logic

Phase 4.6.1.1 setBudgets
Phase 4.6.1.1 setBudgets | Checksum: 12ba0f6e7

Time (s): cpu = 00:00:02 ; elapsed = 00:00:01 . Memory (MB): peak = 932.539 ; gain = 0.000

Phase 4.6.1.2 Commit Slice Clusters
Phase 4.6.1.2 Commit Slice Clusters | Checksum: 11bbfe2ea

Time (s): cpu = 00:00:02 ; elapsed = 00:00:02 . Memory (MB): peak = 932.539 ; gain = 0.000
Phase 4.6.1 Commit Small Macros & Core Logic | Checksum: 11bbfe2ea

Time (s): cpu = 00:00:02 ; elapsed = 00:00:02 . Memory (MB): peak = 932.539 ; gain = 0.000

Phase 4.6.2 Clock Restriction Legalization for Leaf Columns
Phase 4.6.2 Clock Restriction Legalization for Leaf Columns | Checksum: 11bbfe2ea

Time (s): cpu = 00:00:02 ; elapsed = 00:00:02 . Memory (MB): peak = 932.539 ; gain = 0.000

Phase 4.6.3 Clock Restriction Legalization for Non-Clock Pins
Phase 4.6.3 Clock Restriction Legalization for Non-Clock Pins | Checksum: 11bbfe2ea

Time (s): cpu = 00:00:02 ; elapsed = 00:00:02 . Memory (MB): peak = 932.539 ; gain = 0.000
Phase 4.6 Small Shape Detail Placement | Checksum: 11bbfe2ea

Time (s): cpu = 00:00:02 ; elapsed = 00:00:02 . Memory (MB): peak = 932.539 ; gain = 0.000

Phase 4.7 Re-assign LUT pins
Phase 4.7 Re-assign LUT pins | Checksum: 11bbfe2ea

Time (s): cpu = 00:00:02 ; elapsed = 00:00:02 . Memory (MB): peak = 932.539 ; gain = 0.000
Phase 4 Detail Placement | Checksum: 11bbfe2ea

Time (s): cpu = 00:00:02 ; elapsed = 00:00:02 . Memory (MB): peak = 932.539 ; gain = 0.000

Phase 5 Post Placement Optimization and Clean-Up

Phase 5.1 PCOPT Shape updates
Phase 5.1 PCOPT Shape updates | Checksum: 139fec177

Time (s): cpu = 00:00:02 ; elapsed = 00:00:02 . Memory (MB): peak = 932.539 ; gain = 0.000

Phase 5.2 Post Commit Optimization

Phase 5.2.1 updateClock Trees: PCOPT
Phase 5.2.1 updateClock Trees: PCOPT | Checksum: 139fec177

Time (s): cpu = 00:00:02 ; elapsed = 00:00:02 . Memory (MB): peak = 932.539 ; gain = 0.000

Phase 5.2.2 Post Placement Optimization

Phase 5.2.2.1 Post Placement Timing Optimization
INFO: [Place 30-746] Post Placement Timing Summary WNS=0.524. For the most accurate timing information please run report_timing.
Phase 5.2.2.1 Post Placement Timing Optimization | Checksum: 148def62c

Time (s): cpu = 00:00:02 ; elapsed = 00:00:02 . Memory (MB): peak = 932.539 ; gain = 0.000
Phase 5.2.2 Post Placement Optimization | Checksum: 148def62c

Time (s): cpu = 00:00:02 ; elapsed = 00:00:02 . Memory (MB): peak = 932.539 ; gain = 0.000
Phase 5.2 Post Commit Optimization | Checksum: 148def62c

Time (s): cpu = 00:00:02 ; elapsed = 00:00:02 . Memory (MB): peak = 932.539 ; gain = 0.000

Phase 5.3 Sweep Clock Roots: Post-Placement
Phase 5.3 Sweep Clock Roots: Post-Placement | Checksum: 148def62c

Time (s): cpu = 00:00:02 ; elapsed = 00:00:02 . Memory (MB): peak = 932.539 ; gain = 0.000

Phase 5.4 Post Placement Cleanup
Phase 5.4 Post Placement Cleanup | Checksum: 148def62c

Time (s): cpu = 00:00:02 ; elapsed = 00:00:02 . Memory (MB): peak = 932.539 ; gain = 0.000

Phase 5.5 Placer Reporting

Phase 5.5.1 Restore STA
Phase 5.5.1 Restore STA | Checksum: 148def62c

Time (s): cpu = 00:00:02 ; elapsed = 00:00:02 . Memory (MB): peak = 932.539 ; gain = 0.000
Phase 5.5 Placer Reporting | Checksum: 148def62c

Time (s): cpu = 00:00:02 ; elapsed = 00:00:02 . Memory (MB): peak = 932.539 ; gain = 0.000

Phase 5.6 Final Placement Cleanup
Phase 5.6 Final Placement Cleanup | Checksum: 1a89e19d9

Time (s): cpu = 00:00:02 ; elapsed = 00:00:02 . Memory (MB): peak = 932.539 ; gain = 0.000
Phase 5 Post Placement Optimization and Clean-Up | Checksum: 1a89e19d9

Time (s): cpu = 00:00:02 ; elapsed = 00:00:02 . Memory (MB): peak = 932.539 ; gain = 0.000
Ending Placer Task | Checksum: b0a956a7

Time (s): cpu = 00:00:00 ; elapsed = 00:00:02 . Memory (MB): peak = 932.539 ; gain = 0.000
INFO: [Common 17-83] Releasing license: Implementation
33 Infos, 0 Warnings, 0 Critical Warnings and 0 Errors encountered.
place_design completed successfully
Writing placer database...
Writing XDEF routing.
Writing XDEF routing logical nets.
Writing XDEF routing special nets.
Write XDEF Complete: Time (s): cpu = 00:00:00 ; elapsed = 00:00:00.130 . Memory (MB): peak = 932.539 ; gain = 0.000
report_io: Time (s): cpu = 00:00:00 ; elapsed = 00:00:00.070 . Memory (MB): peak = 932.539 ; gain = 0.000
report_utilization: Time (s): cpu = 00:00:00 ; elapsed = 00:00:00.040 . Memory (MB): peak = 932.539 ; gain = 0.000
report_control_sets: Time (s): cpu = 00:00:00 ; elapsed = 00:00:00 . Memory (MB): peak = 932.539 ; gain = 0.000
Command: phys_opt_design
Attempting to get a license for feature 'Implementation' and/or device 'xc7z010'
INFO: [Common 17-349] Got license for feature 'Implementation' and/or device 'xc7z010'
INFO: [Vivado_Tcl 4-383] Design worst setup slack (WNS) is greater than or equal to 0.500 ns. Skipping all physical synthesis optimizations.
INFO: [Vivado_Tcl 4-232] No setup violation found. The netlist was not modified.
INFO: [Common 17-83] Releasing license: Implementation
37 Infos, 0 Warnings, 0 Critical Warnings and 0 Errors encountered.
phys_opt_design completed successfully
Writing placer database...
Writing XDEF routing.
Writing XDEF routing logical nets.
Writing XDEF routing special nets.
Write XDEF Complete: Time (s): cpu = 00:00:00 ; elapsed = 00:00:00.110 . Memory (MB): peak = 932.539 ; gain = 0.000
Command: route_design
Attempting to get a license for feature 'Implementation' and/or device 'xc7z010'
INFO: [Common 17-349] Got license for feature 'Implementation' and/or device 'xc7z010'
Running DRC as a precondition to command route_design
INFO: [Drc 23-27] Running DRC with 2 threads
INFO: [Vivado_Tcl 4-198] DRC finished with 0 Errors
INFO: [Vivado_Tcl 4-199] Please refer to the DRC report (report_drc) for more information.


Starting Routing Task
INFO: [Route 35-254] Multithreading enabled for route_design using a maximum of 2 CPUs

Phase 1 Build RT Design
WARNING: [Route 35-198] Port "ap_start" does not have an associated HD.PARTPIN_LOCS, which will prevent the partial routing of the signal "ap_start". Without this partial route, timing analysis to/from this port will not be accurate, and no routing information for this port can be exported.
WARNING: [Route 35-198] Port "ap_rst" does not have an associated HD.PARTPIN_LOCS, which will prevent the partial routing of the signal "ap_rst". Without this partial route, timing analysis to/from this port will not be accurate, and no routing information for this port can be exported.
WARNING: [Route 35-198] Port "a_q0[3]" does not have an associated HD.PARTPIN_LOCS, which will prevent the partial routing of the signal "a_q0[3]". Without this partial route, timing analysis to/from this port will not be accurate, and no routing information for this port can be exported.
WARNING: [Route 35-198] Port "a_q0[4]" does not have an associated HD.PARTPIN_LOCS, which will prevent the partial routing of the signal "a_q0[4]". Without this partial route, timing analysis to/from this port will not be accurate, and no routing information for this port can be exported.
WARNING: [Route 35-198] Port "b_q0[0]" does not have an associated HD.PARTPIN_LOCS, which will prevent the partial routing of the signal "b_q0[0]". Without this partial route, timing analysis to/from this port will not be accurate, and no routing information for this port can be exported.
WARNING: [Route 35-198] Port "b_q0[3]" does not have an associated HD.PARTPIN_LOCS, which will prevent the partial routing of the signal "b_q0[3]". Without this partial route, timing analysis to/from this port will not be accurate, and no routing information for this port can be exported.
WARNING: [Route 35-198] Port "b_q0[6]" does not have an associated HD.PARTPIN_LOCS, which will prevent the partial routing of the signal "b_q0[6]". Without this partial route, timing analysis to/from this port will not be accurate, and no routing information for this port can be exported.
WARNING: [Route 35-198] Port "b_q0[7]" does not have an associated HD.PARTPIN_LOCS, which will prevent the partial routing of the signal "b_q0[7]". Without this partial route, timing analysis to/from this port will not be accurate, and no routing information for this port can be exported.
WARNING: [Route 35-198] Port "a_q0[2]" does not have an associated HD.PARTPIN_LOCS, which will prevent the partial routing of the signal "a_q0[2]". Without this partial route, timing analysis to/from this port will not be accurate, and no routing information for this port can be exported.
WARNING: [Route 35-198] Port "a_q0[5]" does not have an associated HD.PARTPIN_LOCS, which will prevent the partial routing of the signal "a_q0[5]". Without this partial route, timing analysis to/from this port will not be accurate, and no routing information for this port can be exported.
WARNING: [Route 35-198] Port "b_q0[1]" does not have an associated HD.PARTPIN_LOCS, which will prevent the partial routing of the signal "b_q0[1]". Without this partial route, timing analysis to/from this port will not be accurate, and no routing information for this port can be exported.
WARNING: [Route 35-198] Port "b_q0[2]" does not have an associated HD.PARTPIN_LOCS, which will prevent the partial routing of the signal "b_q0[2]". Without this partial route, timing analysis to/from this port will not be accurate, and no routing information for this port can be exported.
WARNING: [Route 35-198] Port "b_q0[5]" does not have an associated HD.PARTPIN_LOCS, which will prevent the partial routing of the signal "b_q0[5]". Without this partial route, timing analysis to/from this port will not be accurate, and no routing information for this port can be exported.
WARNING: [Route 35-198] Port "a_q0[0]" does not have an associated HD.PARTPIN_LOCS, which will prevent the partial routing of the signal "a_q0[0]". Without this partial route, timing analysis to/from this port will not be accurate, and no routing information for this port can be exported.
WARNING: [Route 35-198] Port "a_q0[1]" does not have an associated HD.PARTPIN_LOCS, which will prevent the partial routing of the signal "a_q0[1]". Without this partial route, timing analysis to/from this port will not be accurate, and no routing information for this port can be exported.
WARNING: [Route 35-198] Port "b_q0[4]" does not have an associated HD.PARTPIN_LOCS, which will prevent the partial routing of the signal "b_q0[4]". Without this partial route, timing analysis to/from this port will not be accurate, and no routing information for this port can be exported.
WARNING: [Route 35-198] Port "a_q0[6]" does not have an associated HD.PARTPIN_LOCS, which will prevent the partial routing of the signal "a_q0[6]". Without this partial route, timing analysis to/from this port will not be accurate, and no routing information for this port can be exported.
WARNING: [Route 35-198] Port "a_q0[7]" does not have an associated HD.PARTPIN_LOCS, which will prevent the partial routing of the signal "a_q0[7]". Without this partial route, timing analysis to/from this port will not be accurate, and no routing information for this port can be exported.
Phase 1 Build RT Design | Checksum: 166c0c7be

Time (s): cpu = 00:00:29 ; elapsed = 00:00:27 . Memory (MB): peak = 969.785 ; gain = 37.246

Phase 2 Router Initialization

Phase 2.1 Create Timer
Phase 2.1 Create Timer | Checksum: 166c0c7be

Time (s): cpu = 00:00:29 ; elapsed = 00:00:27 . Memory (MB): peak = 969.785 ; gain = 37.246

Phase 2.2 Pre Route Cleanup
Phase 2.2 Pre Route Cleanup | Checksum: 166c0c7be

Time (s): cpu = 00:00:29 ; elapsed = 00:00:27 . Memory (MB): peak = 974.578 ; gain = 42.039
 Number of Nodes with overlaps = 0

Phase 2.3 Update Timing
Phase 2.3 Update Timing | Checksum: 1c950f33f

Time (s): cpu = 00:00:29 ; elapsed = 00:00:27 . Memory (MB): peak = 975.469 ; gain = 42.930
INFO: [Route 35-57] Estimated Timing Summary | WNS=0.472  | TNS=0      | WHS=-0.089 | THS=-1.05  |

Phase 2 Router Initialization | Checksum: 204b3d0c5

Time (s): cpu = 00:00:29 ; elapsed = 00:00:27 . Memory (MB): peak = 975.469 ; gain = 42.930

Phase 3 Initial Routing
Phase 3 Initial Routing | Checksum: e90fec42

Time (s): cpu = 00:00:29 ; elapsed = 00:00:27 . Memory (MB): peak = 975.469 ; gain = 42.930

Phase 4 Rip-up And Reroute

Phase 4.1 Global Iteration 0
 Number of Nodes with overlaps = 30
 Number of Nodes with overlaps = 3
 Number of Nodes with overlaps = 1
 Number of Nodes with overlaps = 0

Phase 4.1.1 Update Timing
Phase 4.1.1 Update Timing | Checksum: 25278b516

Time (s): cpu = 00:00:29 ; elapsed = 00:00:27 . Memory (MB): peak = 975.469 ; gain = 42.930
INFO: [Route 35-57] Estimated Timing Summary | WNS=0.252  | TNS=0      | WHS=N/A    | THS=N/A    |

Phase 4.1 Global Iteration 0 | Checksum: 148f6aa3c

Time (s): cpu = 00:00:29 ; elapsed = 00:00:27 . Memory (MB): peak = 975.469 ; gain = 42.930
Phase 4 Rip-up And Reroute | Checksum: 148f6aa3c

Time (s): cpu = 00:00:29 ; elapsed = 00:00:27 . Memory (MB): peak = 975.469 ; gain = 42.930

Phase 5 Delay CleanUp

Phase 5.1 Update Timing
Phase 5.1 Update Timing | Checksum: 1b4bc11ef

Time (s): cpu = 00:00:29 ; elapsed = 00:00:27 . Memory (MB): peak = 975.469 ; gain = 42.930
INFO: [Route 35-57] Estimated Timing Summary | WNS=0.402  | TNS=0      | WHS=N/A    | THS=N/A    |

Phase 5 Delay CleanUp | Checksum: 1b4bc11ef

Time (s): cpu = 00:00:29 ; elapsed = 00:00:27 . Memory (MB): peak = 975.469 ; gain = 42.930

Phase 6 Clock Skew Optimization
Phase 6 Clock Skew Optimization | Checksum: 1b4bc11ef

Time (s): cpu = 00:00:29 ; elapsed = 00:00:27 . Memory (MB): peak = 975.469 ; gain = 42.930

Phase 7 Post Hold Fix

Phase 7.1 Update Timing
Phase 7.1 Update Timing | Checksum: 1e0c663b4

Time (s): cpu = 00:00:30 ; elapsed = 00:00:27 . Memory (MB): peak = 975.469 ; gain = 42.930
INFO: [Route 35-57] Estimated Timing Summary | WNS=0.402  | TNS=0      | WHS=0.18   | THS=0      |

Phase 7 Post Hold Fix | Checksum: 20dfab7af

Time (s): cpu = 00:00:30 ; elapsed = 00:00:27 . Memory (MB): peak = 975.469 ; gain = 42.930

Phase 8 Route finalize

Router Utilization Summary
  Global Vertical Routing Utilization    = 0.0434966 %
  Global Horizontal Routing Utilization  = 0.051011 %
  Routable Net Status*
  *Does not include unroutable nets such as driverless and loadless.
  Run report_route_status for detailed report.
  Number of Failed Nets               = 0
  Number of Unrouted Nets             = 0
  Number of Partially Routed Nets     = 0
  Number of Node Overlaps             = 0

Phase 8 Route finalize | Checksum: 16ddd4090

Time (s): cpu = 00:00:30 ; elapsed = 00:00:27 . Memory (MB): peak = 975.469 ; gain = 42.930

Phase 9 Verifying routed nets

 Verification completed successfully
Phase 9 Verifying routed nets | Checksum: 16ddd4090

Time (s): cpu = 00:00:30 ; elapsed = 00:00:27 . Memory (MB): peak = 977.598 ; gain = 45.059

Phase 10 Depositing Routes
Phase 10 Depositing Routes | Checksum: 156b92402

Time (s): cpu = 00:00:30 ; elapsed = 00:00:27 . Memory (MB): peak = 977.598 ; gain = 45.059

Phase 11 Post Router Timing
INFO: [Route 35-57] Estimated Timing Summary | WNS=0.402  | TNS=0      | WHS=0.18   | THS=0      |

INFO: [Route 35-327] The final timing numbers are based on the router estimated timing analysis. For a complete and accurate timing signoff, please run report_timing_summary.
Phase 11 Post Router Timing | Checksum: 156b92402

Time (s): cpu = 00:00:30 ; elapsed = 00:00:27 . Memory (MB): peak = 977.598 ; gain = 45.059
INFO: [Route 35-16] Router Completed Successfully

Routing Is Done.

Time (s): cpu = 00:00:00 ; elapsed = 00:00:28 . Memory (MB): peak = 977.598 ; gain = 45.059
INFO: [Common 17-83] Releasing license: Implementation
50 Infos, 18 Warnings, 0 Critical Warnings and 0 Errors encountered.
route_design completed successfully
route_design: Time (s): cpu = 00:00:31 ; elapsed = 00:00:28 . Memory (MB): peak = 977.598 ; gain = 45.059
Writing placer database...
Writing XDEF routing.
Writing XDEF routing logical nets.
Writing XDEF routing special nets.
Write XDEF Complete: Time (s): cpu = 00:00:00 ; elapsed = 00:00:00.140 . Memory (MB): peak = 977.598 ; gain = 0.000
INFO: [Drc 23-27] Running DRC with 2 threads
INFO: [Coretcl 2-168] The results of DRC are in file C:/Users/Kasper/Documents/GitHub/TIHSC/Exercise2/HLS_labs/lab1/matrixmul.prj/solution1/impl/vhdl/project.runs/impl_1/matrixmul_drc_routed.rpt.
INFO: [Timing 38-91] UpdateTimingParams: Speed grade: -1, Delay Type: min_max.
INFO: [Timing 38-191] Multithreading enabled for timing update using a maximum of 2 CPUs
Running Vector-less Activity Propagation...

Finished Running Vector-less Activity Propagation
INFO: [Common 17-206] Exiting Vivado at Thu May 07 14:07:02 2015...
